Type,Removed_stopwords
1,رئيس الوزراء العراقي يوافق طلب استقالة وزير الصحة
1,الكشف وفاة فلسطينيات حريق مستشفى ابن الخطيب
1,وفاة دبلوماسية سويسرية اثر سقوطها مبنى عالي
1,الخارجیة الایرانیة تستدعی سفیر سویسرا فی طهران
1,واشنطن اوضحت للحكومة الايرانية مخاوفها بشان الانشطة البحرية للحرس الثوري الايراني
1,الحرس الثوري الايراني متهم بقمع المدنيين احتجاجات ايران
1,شن مسلحو حركة طالبان هجوما واسعا مدينة لشكرغاه عاصمة ولاية هلمند
1,الاف النازحين بافغانستان طالبان تتهيا لـ بحور الدم
1,ازدادت الاوضاع الصحية الهند تدهورا تسجيل اكثر مليون اصابة بفيروس كورونا
1,عرض جانبي يصيب نصف متلقي لقاح فايزر
1,دعت اديس ابابا الى انهاء المفاوضات الثلاثية وفقا لاتفاقية اعلان المبادئ
1,اثيوبيا ترفض ربط ملف الحدود السودان بسد النهضة وتتهم
1,العراق يتحرك دخول وزير دفاع تركيا موافقة
1,انقرة تعلن انشاء قاعدة عسكرية تركية بشمال العراق
1,زير الدفاع التركي اكار متحدثا اثناء لقائه جنوده العاملين بليبيا ان اليونان تنجح الغاء اتفاقية ترسيم الحدود البحرية
1,تركيا وليبيا ملتزمتان باتفاق ترسيم الحدود البحرية
1,الحكومتان المصرية والفرنسية توقعان عقد شراء طائرة طراز رافال
1,فرنسا الى ايطاليا الى امريكا المسلة المصرية تزين ميادين العالم
1,توقف لاشهر استانف لبنان واسرائيل المفاوضات التقنية لترسيم الحدود البحرية بينهم
1,تساؤلات تعود للواجهة بدء مفاوضات ترسيم الحدود البحرية
1,الماساة تتفاقم رقم مفزع لضحايا كورونا الهند
1,النفط يسقط قمة اسابيع ماساة الهند
1,مقتل العشرات جراء انهيار جسر قطار مترو معلق المكسيك
1,قتلى وجرحى تفجيرين بالعاصمة
1,قال مكتب التحقيقات الفدرالي ان احد عناصره اطلق النار شخص حاول الهجوم حراس مقر وكالة
1,اطلاق نار مدرسة ثانوية بالولايات المتحدة ومقتل شخص واصابة شرطي
1,صواريخ سقطت قاعدة بلد الجوية استهداف مطار بغداد
1,وفد اميركي بغداد لبحث وجود جندي العراق
1,قال القائم باعمال رئيس وزراء ارمينيا ان الجيش الروسي اقام موقعين عسكريين جديدين جنوب بلاده بالقرب حدود اذربيجان
1,الجيش الروسي يختبر بنجاح صاروخا جديدا مضادا للصواريخ
1,قال وزير الخارجية التركي ان اولوياتهم المحافظة وحدة الاراضي الليبية
1,سياسيون يخشون هيمنة تركيا ليبيا
1,اعلن الجيش العراقي القاء القبض والي مدينة الفلوجة المتهم بتنفيذ عمليات ارهابية
1,اشتباكات الجيش العراقي وتنظيم داعش وقصف تركي
1,استئناف مفاوضات اسرائيل يعكس رغبة لبنان تحقيق نتائج تسهم حفظ الاستقرار بالمنطقة الجنوبية
1,لبنان يوسع مطالبه بالحدود البحرية اسرائيل
1,قال نتنياهو انه اخبر بينيت انه استعداد لقبول طلبه لرئاسة بترتيب التناوب
1,زعيم اقصى اليسار يفشل تشكيل حكومة يسارية
1,مباحثات قطرية حول تطورات الصومال والسودان
1,وزير العمل الصومالي يدعو رجال الاعمال القطريين للاستثمار بلاده
1,يرى معارضون ان مسلسل الاختيار سعى لتقديم رواية مزورة لتاريخ قريب
1,اتهامات بتزوير شهادات مجال التمريض البوسنة
1,الاردن يطالب بضغط دولي اسرائيل لوقف انتهاكاتها بـ الاقصى
1,مسؤول امني اسرائيلي زار الاردن مطلع الاسبوع
2,توقعات بوصول ارسنال لنهائي الدوري الاوروبي
2,الدوري الاوروبي ارسنال يتعثر ومانشستر يونايتد يتالق
2,اكد الفرنسي هيرفي رينارد مدرب المنتخب السعودي انه سيلقي بكل ثقله البطولة كاس العرب اجل الفوز باللقب
2,قرعة كاس العرب قطر تواجه العراق والمغرب يلاقي السعودية
2,اعلنت رابطة الدوري الانجليزي الممتاز اقامة مباراة مانشستر يونايتد المؤجلة امام ضيفه ليفربول
2,تاجيل مباراة مانشستر يونايتد وليفربول اقتحام مشجعين ملعب اولد ترافورد
2,شنت وسائل الاعلام الفرنسية هجوما حادا ضد البرازيلي نيمار
2,ارتفاع حظوظ برشلونة استعادة نيمار
2,استبعاد المدعي الخاص قضية رئيس فيفا جياني انفانتينو
2,فساد فيفا يتوقف انفانتينو يمثل امام القضاء السويسري قضية جديدة
2,رابطة الدوري الانجليزي الممتاز تسماح لعدد محدود فقط المشجعين للعودة الى الملاعب اخر جولتين موسم
2,منع جماهير الفرق تلعب خارج ارضها اخر جولتين الدوري الانجليزي
2,هيريرا لاعب باريس سان جيرمان ان زميله تعرض لاساءة لفظية الحكم الهولندي
2,اصابة لاعبي باريس سان جيرمان بكورونا
2,عتزم رابطة المحترفين اسبانيا التحقيق ادعاءات حول انتهاك ميسي لبروتوكولات الصحة المطبقة لمكافحة فيروس كورونا
2,اسلحة باريس سان جيرمان السرية لتحقيق صفقة الحلم وضم ميسي
2,السيتي يكتب التاريخ ويصعد الى نهائي دوري ابطال اوروبا تغلبه باريس سان جيرمان
2,البرتغالي دياز افضل لاعب مواجهة مان سيتي وسان جيرمان
2,الـنفيعـي رئيسا للنادي الاهلي
2,رئيس اهلي جدة الجديد يكشف السبب الحقيقي وراء عودته
2,اعرب بيرهوف مدير الاتحاد الالماني لكرة القدم اعتقاده ان فليك يعد افضل مرشح لخلافة لوف تدريب المنتخب الالماني
2,احباط وذهول عقب الهزيمة التاريخية لمنتخب المانيا امام مقدونيا
2,تشيلسي يؤكد ان ممثلين الجماهير سيتم اختيارهم بالانتخاب سيحضرون اجتماعات الادارة
2,تشيلسي ومانشستر سيتي يعلنان انسحابهما دوري السوبر
2,اعلن الاتحاد المصري لكرة القدم ايقاف سيد عبد الحفيظ مدير الكرة بالنادي الاهلي واحالته الى التحقيق وذلك اثر تصريحاته بشان الحكام
2,الاتحاد المصري يقرر مشاركة المنتخب الاول كاس العرب
2,اعلن النادي الاهلي المصري انه طالب الاتحاد المصري بتعيين حكام اجانب التصنيف الاول اوروبيا
2,الحزن يخيم لاعبى الاهلى السقوط امام غزل المحلة بهدف
2,اعلن نادي روما لكرة القدم انه البرتغالي المخضرم مدربا لفريقه
2,اقالة جوزيه مورينيو
2,النصر المنتشي بالتاهل الاسيوي يواجه الفيصلي
2,النصر يتلقى ضربة موجعة باصابة نجمه موقعة الفيصلي
2,اختير اللاعب المخضرم كعضو احتياطي الفريق يشرف تنظيم انتخابات محلية
2,انتخابات محلية اسبانية وسط تعقيدات نزعات قومية
2,روما الايطالي يعلن رحيل مدربه فونسيكا بنهاية الموسم
2,تحديات تنتظر مورينيو موسمه الجديد روما
2,الاهلي يوقع عقوبات مالية اللاعبين عقب الخسارة امام غزل
2,حرمان لاعبي الاهلي مباراة افريقية واحدة
2,بارما يلحق بكروتوني ويهبط لدوري الدرجة الثانية الايطالي الخسارة تورينو
2,مجموعة امريكية تستحوذ نادي بارما الايطالي
2,هدف قاتل اتلتيك بلباو يفوز اشبيلية ويعقد اماله صراع لقب الدوري الاسباني
2,اشبيلية يواجه اتلتيك بيلباو للبقاء بدائرة المنافسة فى الدوري الاسباني
2,السماح بحضور مشجع لنهائي الدوري الاوروبي مدينة غدانسك البولندية
2,مواجهات قوية نصف نهائي الدوري الاوروبي لكرة القدم
2,اقتصر السباق الانتخابي لرئاسة نادي اهلي جدة ماجد النفيعي وزياد اليوسف
2,اعلان القوائم النهائية لمرشحي رئاسة اهلي جدة السعودي
2,لاعبو ايطاليا يتلقون الجرعة الاولى اللقاح ضد كوفيد
2,ارتفاع عدد مصابي كورونا منتخب ايطاليا
2,اقترب فريق وست بروميتش البيون خطوة جديدة الهبوط الدوري الانجليزي الممتاز
2,اليوم الجماهير تحضر الجولات الاخيرة الدوري الانجليزي لندن
2,اعلن الاتحاد الاوروبي توقيف غاي لمباراتين بسبب حصوله بطاقة حمراء
2,سيتي يسعى للنهائي الاوروبي الاول تاريخه وسان جرمان للثاني تواليا
2,اعلن نادي مانشستر يونايتد انه سيعاقب اي مشجع يثبت تورطه باقتحام اولد ترافور
2,جماهير مانشستر يونايتد تقتحم ملعب اولد ترافورد
2,فتح الاتحاد الانجليزي لكرة القدم تحقيقا رسميا اندية بسبب السوبر الاوروبى
2,الاتحاد الانجليزي يصعد حربه ضد مواقع التواصل الاجتماعي
2,اعرب مدافع مانشستر سيتي انتظاره بشغف للمواجهة مهاجمي باريس سان جيرمان البرازيلي نيمار وزميله الفرنسي كيليان مبابي
2,نيمار ومبابي راس قائمة سان جيرمان لمواجهة مانشستر سيتي
2,لاعب فريق برايتون الانجليزي نيال موباي مهدد بالقتل شاب سنغافوري
2,برايتون يتعاقد رسميا مهاجم ارسنال ويلبيك بصفقة انتقال حر
2,ضربة جديدة لاندية الليجا وصفت بانها تمييزية توصية بعدم عودة الجماهير الاسبانية الموسم
2,الجماهير الاسبانية تنتظر الضوء الاخضر للعودة الى الملاعب
2,تسببت طائرة مسيرة صغيرة ايقاف مباراة كرة القدم الغريمين الدوري الارجنتيني روساريو سنترال ونيويلز اولد بويز
2,اندبندنتي يواصل صحوته بكاس رابطة الدوري الارجنتيني
2,ذكر مدريد بيان ان رافاييل فاران مدافع الفريق سيغيب اياب الدور نصف النهائي امام تشيلسي
2,اليويفا يكلف شرطيا بتحكيم مباراة مدريد وتشيلسي
2,تاجلت مباريات بدور المجموعات لكاس الاتحاد الاسيوي بمنطقة الشرق الى بسبب صعوبات التعامل وباء كورونا
2,تاجيل مباريات الاردن بسبب الاحوال الجوية
2,نادي الزمالك يقرر تقديم شكوى الى اللجنة الاولمبية المصرية ووزارة الرياضة ضد اعتبره تجاوزات ضد النادي كرة القدم وكرة اليد وكرة السلة
2,الزمالك يتراجع قضية نادي القرن ويزيل احدى لافتاته
2,فالنسيا اقال مدربه غراسيا ان اصبح الفريق نقاط منطقة الهبوط بدوري عقب الخسارامام برشلونة
2,سحر ميسي ينقذ برشلونة فخ فالنسيا
2,ضاعف سامبدوريا جراح مشاكل ضيفه يصعقه بهزيمة بهدفين
2,مدرب روما رحمة مانشستر يونايتد
2,جاريث بيل يقود توتنهام للفوز صفر شيفيلد يونايتد
2,غاريث بيل يعود الى صفوف توتنهام قادما مدريد
2,رونالدو يقلب تاخر يوفنتوس الى فوز اودينيزي
2,ثنائية رونالدو تبقي يوفنتوس سباق التاهل لدوري ابطال اوروباي
2,جوزيه مورايس مدربا للفريق الهلال خلفا للبرازيلي روجير
2,مجزرة الهلال رحيل نجوم والتعاقد اخرين
2,اياكس يقبض الدوري الهولندي للمرة الـ
2,اياكس يوضح موقفه اعادة فان دي بيك
2,رسميا انتر ميلان يحسم لقب الدوري الايطالي وينهي هيمنة يوفنتوس
2,غضب ايطاليا بسبب احتفالات جماهير انتر ميلان
2,ارسنال يستعيد الصدارة هزيمة نيوكاسل
2,بطلب ارتيتا ارسنال يسعى لتمديد عقد روب هولدينج
2,اعلن نادي بوروسيا دورتموند ان مدافعه يغيب لفترة طويلة الملاعب تعرضه لاصابة قوية الركبة
2,هالاند يخبر بوروسيا دورتموند بقراره النهائي بشان مستقبله
2,هدف الغازي الرائع يمنح استون فيلا الفوز ايفرتون
2,ايفرتون يخطط لتدعيم دفاعه بنجم برشلونة
2,ميلان يستعيد المركز الثاني مؤقتا
2,يوفنتوس يستعد لموقعة ميلان بالقوة الضاربة
2,مدريد ينتصر اوساسونا الدوري الاسباني
2,مدريد عودة لاعبين الاصابة
2,نهائي كاس المانيا دورتموند ولايبزيغ
2,نهائي كاس المانيا جمهور
2,اقترب فريق انتر ميلان خطوة جديدة لقب الدوري الايطالي لكرة القدم
2,انتر ميلان ينهي هيمنة يوفنتوس
2,اتلتيكو ضد اشبيلية ركلة جزاء ضائعة فى شوط سلبي بالدوري
2,تنفيذها بـ دقائق شاهد الحكم يعيد ركلة جزاء ضائعة
0,حققت شركة مبادلة التابعة لحكومة ابوظبي ارتفاعا اجمالي دخل شركة الاستثمار بنسبة يعادل مليار
0,مبادلة للاستثمار تقترب الطرح الاولي لـ الامارات للالمنيوم
0,هبطت اسعار النفط زيادة عدد حالات الاصابة بكورونا المناطق العالم
0,ارتفاع اسعار النفط تنامي امال تعافي الطلب
0,بدات المحادثات حول اتفاقية التجارة والاستثمار الاتحاد الاوروبي والهند
0,مليار التبادل التجاري اوروبا والهند
0,اعلنت شركة اعمار المدينة الاقتصادية توصية مجلس ادارتها بزيادة راس مال الشركة
0,خسائر اعمار المدينة الاقتصادية ترتفع
0,السلطات اللبنانية تحتجز بواخر الكهرباء التركية اطار شبهات فساد
0,حاكم مصرف لبنان المركزي يواجه تهم فساد جديدة فرنسا
0,تحولت صدارة للكیمیائیات للربحية الربع الاول العام الجاري مسجلة ارباحا فصلية صافية تفوق مليار
0,صدارة للكيميائيات تحققق ارباحا قدرها مليون
0,مشغل خدمات الاتصالات مقره ابوظبي بصدد جمع مليار
0,ارباح شركة اتصالات الاماراتية ترتفع
0,السعودية تعلن اعتماد منتج تامين سفر مواطنيها متضمنا تغطية مخاطر الاصابة بكورونا
0,رفع القيود سفر السعوديين الى الخارج
0,سهم جرير يرتفع لاعلى مستوياته اشهر الاعلان نتائج الربع الاول
0,اعلان شركة جرير للتسويق افتتاح معرضا جديدا بمدينة الرياض
0,ارتفعت مبيعات التجزئة منطقة اليورو بنسبة ٪
0,تراجع مبيعات التجزئة بمنطقة اليورو خلال شهر
0,ارتفع صافي ارباح الشركة السعودية لخدمات السيارات والمعدات ساسكو الزكاة والضريبة بنسبة
0,انخفاض ارباح ساسكو الى مليون
0,اكدت اوبر انها دخلت مسار التعافي الاقتصادي بفضل خدمة التوصيل
0,خدمات التوصيل رافعة اوبر ظل التراجع المستمر
0,ارتفع صافي ارباح شركة الراجحي للتامين التعاوني تكافل الراجحي بنسبة
0,تكافل الراجحي تجدد عقد خدمات تامين مركبات
0,ابوظبي الاول يستحوذ راسمال بنك عوده مصر
0,بنك ابوظبي الاول يرفع الفائدة بنسبة شهادة الادخار
0,موديز تتوقع تراجع عجز ميزانية السعودية لاقل
0,ميزانية السعودية تسجل عجزا بملياري الربع الاول
0,انتعاش النفط عودة الطلب امريكا وبريطانيا
0,النفط يهبط تزايد مخاوف الطلب بفعل ازمة الهند
0,الجنيه المصري يواصل الارتفاع امام الدولار الامريكي الرغم استمرار التداعيات الخطيرة
0,اربعة اعوام تعويم الجنيه المصري الفقر حاله
0,اعلنت وزارة الطاقة السعودية ان المملكة ستنضم الى الولايات المتحدة وكندا والنرويج وقطر لتاسيس منتدى جديد منتدى الحياد الصفري
0,توقع تجميد العلاقات الامريكية السعودية
0,سهم العالمية القابضة يستحوذ النصيب الاكبر التداولات بنسبة
0,تضاعف ارباح العالمية القابضة مرة لـ مليار
0,ارتفعت ارباح بنك الاهلي السعودي بنحو خلال الربع الاول العام الجاري
0,صافي ارباح بنوك الخليج ادنى مستوى سنوات
0,قال الرئيس الاميركي جو بايدن انه يحظى بدعم الحزبين الجمهوري والديمقراطي لتشريع تمويل صناعة اشباه الموصلات
0,تشجيع صناعة اشباه الموصلات امريكا
0,سجلت السعودية رقما قياسيا عالميا جديدا خفض تكلفة الكهرباء الطاقة الشمسية
0,الالواح الشمسية ثنائية الوجه يمكنها انتاج طاقة اكبر بتكلفة اقل
0,مليار سنويا للتمويل الجماعي استثمارات التمويل الجماعي تركز الاعمال التجارية باميركا الشمالية
0,الاوراق المالية تطرح مسودة مشروع المشغل لمنصة التمويل الجماعي
0,قناة السويس تخفض رسومها مرات بسبب تراجع التجارة العالمية
0,تخفيض رسوم التسجيل وممارسة الانشطة الاقتصادية
0,بايدن يقترح زيادة الضرائب الفيدرالية الفئات الاكثر ثراء امريكا
0,توصية بتقليص النفقات ورفع الضرائب
0,مؤشر السوق السعودية يتراجع بنسبة
0,ارتفاع هامشي لسوق الاسهم السعودية بدعم ارامكو
0,المركزي الاوروبي يعتزم تثبيت سعر الفائدة
0,المركزي التركي يبقي معدلات الفائدة تغيير
0,طلب ضعيف الذهب الاردنيين رغم تراجع الاسعار
0,الطلب العالمي الذهب يسجل ادنى مستوى عاما
0,نشاط سوق الصرافة المحلي ضعيف بسبب قلة وجود السياح والمغتربين
0,رفع سعر الحوالات المركزي السوري يغلق شركة صرافة
0,اعلنت وزارة الطاقة طرح عطاء نقل النفط العراقي للاردن خلال اسبوعين
0,انابيب لنقل نفط كردستان الى تركيا
0,تعقد اللجنة الوطنية الاردنية لشؤون المراة سلسلة الندوات والاجتماعات للبدء بتطوير المرحلة الثانية الخطة الوطنية للتمكين الاقتصادي للمراة الاردن
0,بدء بمشروع التمكين الاقتصادي للمراة الفلسطينية
0,وقعت وزارة التخطيط الاردنية اتفاقيات البنك الدولي لتشجيع استثمارات القطاع
0,وزيرة البيئة المصرية تبحث فرص استثمار القطاع الخاص
0,الذهب يقفز اكثر هبوط الدولار وعوائد سندات الخزانة الامريكية
0,تراجع اسعار الذهب عالميا
0,نمت مبيعات العقار الاردن خلال الربع الاول العام الحالي بنسبة
0,ركود يضرب سوق العقار الاردني
0,تلقى برنامج الاغذية العالمي التابع للامم المتحدة مساهمة نقدية قدرها ملايين الحكومة الكندية لدعم اللاجئين الاردن
0,مقيمة كندا تتحصل منحة العيد مستشفى منزل بورقيبة
0,توافق اردني مصري تعزيز النقل البلدين
0,الصمت يخيم حركة النقل الخارجي للمعلمين والمعلمات
0,انخفاض قيمة صادرات محافظة اربد بنسبة مليون
0,مليون صادرات الاردن المجوهرات للولايات المتحدة
0,مخالفة تاجر بسبب لوائح سعرية
0,مخالفة بمبحثين امتحانات التوجيهي
0,الاردن يعلن انخفاض العجز التجاري الثلث الاول العام الحالي بنسبة مقارنة العام
0,ارتفاع العجز التجاري الاردني
0,اغلقت بورصة عمان تداول مليون سهم موزعة عقدا بقيمة تداولات اجمالية بلغت مليون
0,مؤشر البورصة يرتفع هامشيا وسط نشاط بالتداولات
0,ارتفاع ارباح الشركات المساهمة العامة المدرجة بورصة عمان لعام
0,بورصة عمان تدعو الشركات المدرجة لتزويدها بالبيانات المالية
0,مصفاة البترول الاردنية تسجل ارباح بقيمة مليون
0,مصفاة البترول الاردنية تسجل صافي خسائر مليون
0,طالب رئيس لجنة الاقتصاد والاستثمار النيابية بوضع برنامج يتضمن حزمة اجراءات تستبق فتح القطاعات المتوقفة والاكثر تضررا
0,فتح القطاعات والغاء كافة اشكال الحظر مطلع
0,اعلنت الحكومة الفنزويلية زيادة الحد الادنى للاجور الى ملايين بوليفار
0,الضمان تدعو المنشات لالتزام الحد الادنى للاجور
0,سريان اتفاقية التجارة الحرة الاردن وبريطانيا
0,توقيع اتفاقية التجارة الحرة دول مجلس التعاون ودول رابطة الافتا
0,احالت وزارة العمل شكوى ضد منشات الى القضاء
0,القضاء الاعلى يرفض الدعوى المقدمة ضد الكاردينال لويس ساكو
0,السلطات السعودية تصدر قرار منع مئات الشاحنات الاردنية المحملة بالمواد الغذائية والخضروات والمواشي دخول اراضيها
0,الاردن يعيد فتح معبرين حدوديين السعودية وسوريا
0,خسرت بتكوين تدفقات بلغت مليون اسبوع وهي اكبر تدفقات اسبوعية مسجلة
0,بتكوين ترتفع بالمئة قرار مفاجئ ايلون ماسك
