Type,Removed_stopwords
1,وقف اطلاق النار اسرائيل والفلسطينيين يدخل حيز التنفيذ
1,بالتكبير والتهليل احتفالات غزة بانتصار المقاومة
1,الحزن يعم قطاع غزة الاعتداءات الاحتلال المقاومة تتوعد بالرد
1,تركيا تطالب بـ انشاء الية دولية لحماية الفلسطينيين
1,تركيا تطالب اسرائيل بالتوقف مهاجمة الفلسطينيين
1,احتفالات بالانتصار تعم الاراضي الفلسطينية عقب سريان الهدنة
1,رئيس الوزراء الاسرائيلي نتنياهو خائف هزيمة غزة
1,وزير الخارجية الامريكي يصل اسرائيل لتعزيز وقف اطلاق النار
1,امريكا تدعم حق اسرائيل الدفاع نفسها صواريخ المقاومة
1,حذر تقرير لصحيفة امريكية مدة الهدنة حماس اسرائيل ان يكون قصير الاجل
1,اسرائيل تدرس وقف اطلاق النار جانب غزة
1,مسيرات ومظاهرات حاشدة ارجاء الضفة الغربية شعار الغضب
1,اعتصام جماهيري بالعاصمة الاردنية نصرة للقدس والشيخ جراح
1,اعلن رئيس الوزراء الفلسطيني ان الحكومة الفلسطينية سترفع جرائم الاحتلال غزة الى الجنائية الدولية
1,اشتية اولويتنا وقف جرائم الاحتلال غزة فورا
1,اقتحام المسجد الاقصى جديد الهدنة
1,قوات الاحتلال تنسحب الاقصى
1,منظمة الصحة عدد وفيات كورونا اكبر بكثير الارقام المعلنة
1,منظمة الصحة العالمية تعلن انخفاض كبير معدل وفيات كورونا
1,مظاهرات عالمية تضامنا فلسطين ومسيرات الفرح بانتصار المقاومة
1,مظاهرات عالمية حاشدة لوقف العدوان الاسرائيلي
1,اقر وزير الدفاع الاسرائيلي الاسبق بالهزيمة اللاحتلال امام المقاومة الفلسطيية
1,استقالة ليبرمان انتصار سياسي لغزة
1,وفد المخابرات المصرية ويبحث تثبيت وقف اطلاق النار
1,وفد المخابرات المصرية يصل غزة للقاء قادة حماس
1,نائبة فرنسية تنسحب برنامج اسرائيلي عقب اتهامها بـخضوع للاسلاميين
1,نائبة فرنسية تندد بدعوة يهود فرنسا للهجرة الى اسرائيل
1,قالت صحيفة اسرائيلية ان اسرائيل حققت مكاسب تكتيكية حرب غزة
1,قالت صحيفة اسرائيلية ان اتصعيد اسرائيل غزةهو الاعنف حرب
1,اردنيون يحتفلون فلسطين الحدود بانتصار المقاومة
1,ندوة بالاردن تدعو للبناء انجازات المقاومة الفلسطينية
1,الجيش المصري يعلن انطلاق مناورات حماة النيل السودان
1,حماة النيل رسالة سودانية مصرية ردت عليها اثيوبيا
1,وقعت مواجهات الشبان الفلسطينيين وقوات الاحتلال الاسرائيلي مواقع عديدة بالضفة الغربية والقدس المحتلة
1,قوات الاحتلال تنفذ حملات اعتقال بالضفة وتواصل حصار غزة
1,مسيرات واحتفالات عالمية نصرة للمقاومة الفلسطينية
1,فصائل المقاومة الفلسطينية تدعو الى الرباط الاقصى
1,اوروبا تدرس امكانية التواصل حركة حماس
1,مسؤول اوروبي اعلن تضامنه المقاومة الايرانية
1,شيع الاف الفلسطينيين جثامين شهداء قضوا ايام نفق للمقاومة
1,استشهاد رئيس هيئة مقاومة
1,اكدت صحيفة اميركية ان استهداف برج الجلاء شكل نقطة تحول محورية الموقف الاميركي
1,الاسرائيليون نادمون استهداف برج الجلاء غزة
1,مقرر اممي ياكد ان الاخبراء طالبوا بتمثيل العدوان الاسرائيلي امام الجنائية الدولية
1,خبراء امميون يحذرون تصاعد عنف المستوطنين فلسطين
1,تعتقد السلطات الايرانية ان التطورات الاخيرة فلسطين اظهرت بوضوح فشل عمليات تطبيع
1,وزارة الخارجية الايرانية تهنئ انتصار المقاومة معركة سيف القدس
1,دول عربية واسلامية تدين الاعتداء الاسرائيلي الوحشي قطاع غزة
1,نتانياهو الدول العربية والاسلامية تقيم علاقات عميقة اسرائيل
1,امريكا تدعو لاستئناف مفاوضات سد النهضة مصر واثيوبيا
1,واشنطن اعلنت التزامها بدعم مفاوضات السد الاثيوبي
1,اسرائيل تربط ملف الاسرى بالعملية الدولية لاعمار غزة
1,حماس ترفض ربط اعمار غزة بالاسرى الاسرائيليين
1,حالة طوارئ اليونان بسبب زيادة عدد الاجئين السوريين
1,السلطات قبرص تمنع السوريين دخول اراضيها
1,مصرع قائد الجيش النيجيري تحطم طائرة عسكرية
1,الجيش النيجيري يصد هجوما ارهابيا قاعدة عسكرية
1,اجرى وزير الخارجية الاميركي اتصالا هاتفيا نظيره التركي تاكيدا اهمية استمرارالتعاون
1,وزير الخارجية الامريكي ونظيره التركي يبحثان مستجدات الاوضاع فلسطين
1,جنود اسرائيليون يعتقلون العشرات الفلسطينيين القدس والضفة
1,مستوطنون وجنود اسرائيليون يعتدون فلسطينيين بالضفة
1,تواجد قوات الجيش الاثيوبي الحدود الاثيوبية السودانية
1,السودان ينفي وقوع اي اشتباكات اثيوبيا الحدود المشتركة
1,طيار اسرائيلي يعترف ان قصف ابراج غزة وسيلة انتقام
1,قصف الجوي يدمر احد الابراج السكنية العالية غزة
1,الولايات المتحددة تؤكد اهمية استمرارية الهدنة غزة زيارة وزير الخارجيتها للمنطقة
1,بلينكن يزور الاردن ومصر لترسيخ التهدئة غزة
1,ايران تشيد بانتصار المقاومة تدعو لدعم الشعب الفلسطيني
1,ايران تدعو الدول العربية الى اعادة النظر سياسة التطبيع
1,لقطات جوية تظهر حجم الدمار قطاع غزة
1,الصليب الاحمر مصدوم حجم الدمار غزة
1,عمال ميناء جنوب افريقي يرفضون تفريغ حمولة سفينة اسرائيلية
1,جنوب افريقيا تدين العدوان الاسرائيلي الفلسطنيين
1,اعتداءات المستوطنين منازل فلسطينيين الضفة الغربية
1,مستوطنون يعتدون فلسطينيين وممتلكاتهم القدس
1,ملكة بريطانيا تتفقد حاملة الطائرات البريطانية الجديدة
1,ملكة بريطانيا تتفقد معرض تشيلسي للزهور
1,مسعفة تعانق لاجئا وتحميه عناصر الجيش الاسباني
1,ناشطة بالصليب الاحمر الاسباني تتلقى تهديدات عناقها مهاجرا سنغاليا
1,شهدت عواصم اوروبية مظاهرات داعمة للفلسطينيين
1,مظاهرات عدة دول عربية ضد القصف الاسرائيلي لغزة
1,اول ظهور لرئيس حركة حماس لتابين شهداء معركة سيف القدس محافظة قطاع غزة
1,ظهور السنوار يتصدر عناوين الصحف العبرية
1,اسرائيل تقمع تظاهرة تضامنية سكان احياء بالقدس
1,قوات الاحتلال الاسرائيلي تغلق مداخل حي الشيخ جراح
1,امير قطر يهاتف الرئيس الفلسطيني مؤكدا دعم بلاده للقضية الفلسطينية وشعبها
1,ملك الاردن يهاتف امير قطر بشان فلسطين
1,مصر ترفض اعتزام اثيوبيا بناء عدد السدود الجديدة
1,الخارجية المصرية ترد تصريحات ابي احمد
1,انباء انشاء قاعدة عسكرية اماراتية اليمن
1,برلمانيون يمنيون يطالبون توضيحا الامارات حول القاعدة العسكرية
1,قادة اوروبيون يطالبون التحقيق بجرائم الحرب الاسرائيلية
1,تعهد اوروبي بمحاسبة مرتكبي جرائم الحرب سوريا
1,وزيرة الخارجية السودانية تعلن مطالب بلادها لحل ازمة سد النهضة
1,اثيوبيا تبدي استعدادها للاستجابة بشكل كامل لمطالب السودان
1,صرحت وزارة الخارجية المغربية انه تم استدعاء زعيم جبهة البوليساريو لتحقيق اسبانيا
1,المحكمة الاسبانية العليا ترفض طلبا باحتجاز زعيم ابراهيم غالي
1,مدعية الجنائية الدولية تواصل زيارتها لدارفور وتلتقي الاسر النازحة المخيمات
1,بنسودا تبحث جرائم دارفور مسؤولين سودانيين
1,هجمات بطائرات المسيرة العراق تثير قلق امريكا
1,فصائل عراقية تتبنى هجوم الرياض وتقول انه نفذ بطائرات مسيرة
1,الخرطوم الحركة الشعبية لتحرير السودان تبدان مفاوضات السلام
1,الحركة الشعبية لتحرير السودان ترفض مفاوضات السلام
1,اجتماع المبعوثان الاميركي والاممي عمان لبحث ازمة اليمن
1,ليندركينغ وغريفيث يعملان اطلاق محادثات سياسية اليمن
1,امريكا تسلم للافغان اكبر قاعدة عسكرية البلاد
1,طالبان تتبنى تفجيرا قرب قاعدة باغرام الامريكية
1,الرئيس التركي يكشف طريقة التعاون يامل الدول العربية
1,صرح اردوغان ان تركيا تجمعها علاقات قوية مصر
1,اعلن الرئيس الاميركي خلال زيارته الى ولاية اوكلاهوما اننه جاء اجل مساعدة الاميركيين السود
1,بايدن اول رئيس اميركي يحيي ذكرى مذبحة تولسا
1,مالي تخسرعضوية الاتحاد الافريقي مجددا
1,الاتحاد الافريقي يندد بالانقلاب العسكري الجديد مالي
1,يائير لابيد يعلن نجاحه تشكيل ائتلاف حكومي
1,لبيد رئيسا مكلفا بدلا نتنياهو
1,الجيش الاسرائيلي يعلن تدمير نقطة مراقبة سورية الجولان
1,بلينكن يؤكد اهمية الجولان لامن اسرائيل
1,البحرية الايرانية تعلن غرق سفينتها اندلاع حريق غامض
1,صور اقمار صناعية تظهر اكبر سفينة حربية ايرانية غارقة
1,وزير الدفاع الاسرائيلي يوقع اتفاقا لبيد لتشكيل الحكومة
1,لبيد يقترح غانتس تعاونا لاسقاط نتنياهو
1,صورة جوية لسد النهضة تكشف استعدادات اثيوبيا للملء الثاني
1,وقف اعمال البناء سد النهضة الاثيوبي
1,اظهر المفوض العام لوكالة الاونروا الدعم لقلسطينين سكان حي الشيخ جراح القدس
1,مفوض عام اونروا يدعو اسرائيل الى الغاء اخلاء الشيخ جراح
1,رئيس حكومة تصريف الاعمال اللبنانية يتوقع انهيارا شاملا بلاده
1,حسان دياب يناشد حلفاء بلاده لانقاذ لبنان
1,حريق ضخم يلتهم اجزاء مصفاة النفط العاصمة الايرانية
1,ايران تتعرض لحادثين حريق كبيرين يوم
1,وزير الخارجية اليمني يلتقي المبعوث الاميركي اليمن
1,وزير الخارجية السعودي يبحث نظيرته السويدية ازمة اليمن
1,قالت الصحيفة الاسرائيلية ان اعضاء البرلمان الاميركي يدعون الرئيس الامريكي لتعزيز السلام بالشرق الاوسط
1,الكونغرس يطالب بالسلام خلال الدعم حل الدولتين الشرق الاوسط
1,ضحية ومفقود غرق سفينة امداد بترولية مصرية
1,غرق سفينة امداد خليج عمان ضحايا
1,بدء التفاوض الحكومة السودانية والحركة الشعبية
1,السودان تقارب الحكومة والحركة الشعبية وجولة قادمة
1,قتلى وعشرات الضحايا تظاهرات غاضبة منبج اثر حملات تجنيد اجبارية
1,حظر تجول لمدة ساعة احتجاجات رافضة للتجنيد القسري
1,قوات ماليزيا الجوية ترصد طائرات صينية انتهكت مجال البلاد الجوي
1,ماليزيا ترصد سفينة صينية اخترقت مياهها الاقليمية
1,قالت صحيفة اثيوبية ان يجب استغلال مفاوضات بشان سد النهضة كفرصة للتعاون المنبع الصب
1,وزراء دول لمنبع والمصب يبحثون ملء سد النهضة
1,البيت الابيض هدفنا واسرائيل منع ايران حيازة السلاح النووي
1,ايران بعيدة البعد الالتزام بالاتفاق النووي
1,تعهد امريكي جديد بمساعدة السعودية الدفاع اراضيها
1,وزير الدفاع الامريكي يهاتف ولي العهد السعودي بشان اليمن
1,واشنطن تعرض مكافئة مالية ضخمة لمن يساعد بالقبض زعيم التنظيم القاعدة
1,ابو عبيدة يتوعد بقصف تل ابيب مجددا
1,صرحت صحيفة امريكية ان الاحزاب فرنسا تدعم اليمين المتطرف
1,زعيمة اليمين المتطرف فرنسا تقترح تغيير اسم حزبها
1,اعترف الجيش الاميركي انه قتل عشرات المدنيين عام
1,القوات الامريكية العراق تعتذر قتل مدنيين
1,نائب كردي يكشف اتفاق سياسي البارزاني والصدر للمرحلة المقبلة
1,بارزاني يصل النجف للقاء الصدر
1,نتنياهو يحض نواب اليمين منع الثقة الحكومة الجديدة
1,اسرائيل تنتخب رئيسا جديدا وبدء تشكيل حكومة التغيير وانهاء حقبة نتانياهو
1,رئيس وزراء الاسباني يعلن اعادة فتح السفارة الاسبانية فى ليبيا
1,رئيسا وزراء ليبيا واسبانيا يوقعان مذكرات تفاهم طرابلس
1,قررت السلطات المصرية السماح بتعيين النساء مناصب قضائية
1,عزوف النساء تولي المناصب القيادية مصر
1,الامم المتحدة تعارض قانونا دنماركيا لترحيل طالبي اللجوء
1,قرارات الحكومة الدنماركية تهدد حياة اللاجئين اوروبا
1,ناقش منتدى سان بطرسبورغ الاقتصادي الدولي وعددا ملفات الدولية
1,انعقاد منتدى سان بطرسبورغ الاقتصادي الدولي بمشاركة نخبة الاقتصاديين والسياسيين
1,ضحايا مدنيون تفجير حافلات بكابل وننغرهار
1,قتلى وجرحى قصف صاروخي كابل
1,عبرت الامم المتحدة قلقها معاناة النازحين السوريين جراء عدم تمديد عمليات الاغاثة الانسانية
1,الامم المتحدة والمنظمات الشريكة توزع الاغاثة الانسانية الاف السوريين النازحين
1,اعلنت الولايات المتحدة انها تم توزيع ملايين جرعات لقاح كورنا عالميا
1,واشنطن ترسل لتايوان مليون جرعة لقاح موديرنا
1,قال زعيم جماعة الحوثيين ان واجب اليمنيين التصدي الحرب الظالمة تشن عليهم
1,زعيم الحوثيين يعلن جبهات لمواجهة عاصفة الحزم
1,اول جولة خارجية التقى الرئيس الاميركي عددا رؤساء الدول
1,رئيس المجلس الاوروبي يدعو بايدن الى قمة بروكسل
1,وزارة الدفاع الفرنسية توقف العمليات العسكرية الاراضي المالية
1,فرنسا مازق البقاء او الخروج العسكري مالي الانقلاب
1,وزارة الدفاع الاميركي تشيد بدعم قطرلعملية السلام
1,البنتاغون يؤكد ان سحب القوات الامريكية افغانستان بداية عملية السلام
1,بدا رئيس الوزراء الاسرائيلي تحركات مكثفة لافشال الحكومة خصومه
1,حكومة اسرائيل خصوم نتنياهو يتحالفون لاسقاطه
1,القضاء الامريكي سيعطي هجمات البرمجيات الخبيثة اولوية الارهاب
1,العدل الامريكية تدعو الشركات لحماية نفسها الهجمات الالكترونية
1,تحذير مسؤولين اميركيين متابعة التحقيقات بشان نشاة فيروس كورونا معهد ووهان الصيني
1,تقرير اميركي يستبعد تسرب كورونا معمل ووهان الصيني
1,كشفت السلطات الاسترالية اصابات جديدة بالسلالة خطيرة فيروس كورونا
1,مخاوف اوروبية موجة لـسلالة دلتا فيروس كورونا
1,نشرت صحيفة امريكية تقريرا قالت ان الطائرات المسيرة التركية ساعدت تركيا توسيع نفوذها
1,وول ستريت جورنال مسيرات تركيا غيرت القواعد سوريا
1,توقعت امريكا انطلاق جولة جديدة المحادثات ايران لاحياء الاتفاق النووي
1,الخارجية الامريكية ترحب باجتماع الدول الموقعة الاتفاق النووي
1,قلق اميركي سفينتين ايرانيتين تتجهان فنزويلا
1,اسطول النفط الايراني الى فنزويلا يثير غضب الولايات المتحدة
1,مصر وفرنسا والاردن تطالب بوقف الاجراءات الاحادية المقوضة للسلام
1,واشنطن تؤكد دعم حل الدولتين لانهاء النزاع الفلسطيني الاسرائيلي
1,امير قطر والرئيس الروسي يؤكدان اهمية التعاون الدولي لمواجهة تداعيات كورونا
1,امير قطر يشارك منتدى سانت بطرسبورغ الجمعة
1,اكد مجلس صيانة الدستور الايراني ان قرار بشان اهلية المرشحين للرئاسة يتاثر بالوثائق الخاظئة
1,مجلس صيانة الدستور يرى منافسة جدية المرشحين الانتخابات الايرانية
1,السلطات الامريكية تلقي بالمسؤولية الحوثيين لعدم اتخاذ خطوات لوقف اطلاق النار
1,واشنطن تدين بشدة هجمات الحوثي
1,عشرات قتلى والجرحى اثر حادث ثار مصر
1,قتلى بحادث سير مروع صعيد مصر
1,الاحتلال يقمع ماراثون القدس التضامني اهالي الشيخ جراح
1,العديد الفلسطيننين بمشاركة ماراثون القدس
1,ارسلت مصر معدات واليات سواعد مصرية الى قطاع غزة
1,وفد فلسطيني الى مصر لبحث اعمار غزة
1,حذر رئيس حكومة تصريف الاعمال اللبنانية عواقب تعليق عمل المحكمة الدولية الخاصة بلبنان
1,دياب يوجه رسالة للامم المتحدة بشان المحكمة الخاصة بلبنان
1,الرئيس الامريكي يؤكد عدم توتر العلاقات اسرائيل
1,قلق اسرائيلي حيال العلاقة امريكا اخر تصعيد المنطقة
1,اثيوبيا تهاجم الاعلام المصري نشر تسريب لرئيس الوزراء
1,تسريب تصريحات ابي احمد سد اثيوبي تغضب المصريين
1,رغم الحديث اتفاق وشيك بشان النووي الايراني مصادر فيينا تكشف نقاط خلافية زالت عالقة
1,اسرائيل تؤثر مفاوضات فيينا لاتفاق اميركي ايراني قريب
1,اعلن الاتحاد الاوروبي اتاحة شهادة التطعيم رقمية الدول الاعضاء
1,الاتحاد الاوروبي يعتمد شهادة صحية رقمية للسفر
1,الرئيس الروسي ياكد عدم تورط روسيا هجمات الكترونية
1,بوتين روسيا ستوافق تسليم مرتكبي الهجمات الالكترونية
1,واشنطن تقدم مساعدات انسانية باكثر مليون لافغانستان
1,واشنطن تدرس مساعدة الافغان المعرضين
1,انتقد كاردينال النمسا خريطة الاسلام تثير الجدل البلاد
1,تركيا ترفض نشر النمسا خريطة للاسلام
1,هدد رئيس وزراء اسرائيل المتوقع بشن عملية عسكرية قطاع غزة
1,رئيس الوزراء الاسرائيلي الجديد نفتالي بينيت يتعهد بتوحيد الامة
1,عشرات القتلى غارات جوية شنها الجيش الافغاني
1,الجيش الافغاني يفقد اهم نقاط القوة مواجهة حركة طالبان
1,حذر النائب الاول لرئيس مجلس السيادة السوداني فوضى بلاد
1,مواطنون يستنكرون حملة استهداف حميدتي
1,مظاهرات العاصمة المالية جانبه اكد مرشح رئاسة الوزراء التزام بلاده بالاتفاقيات الدولية
1,مظاهرات حاشدة مالي دعما للاستقرار
1,باب الهوى المنفذ الاخير للشمال السوري مهدد بالاغلاق
1,تحذير دولي اممي مخاطر اغلاق معبر باب الهوى
1,وكلاء ايران العراق يقدموا للفصائل اسلحة اكثر تطورا تهديدا للولايات المتحدة
1,مسيرات ايران تقود العراق للمجهول
1,ارتفاع حالات التعافي وقفزة باصابات كورونا عدد الدول اسيوية
1,انخفاض معدلات الاصابة والوفيات بكورونا خلال اسبوع
1,ناشطون يتظاهرون ميناء بكاليفورنيا احتجاجا سفينة شحن اسرائيلية
1,المئات يتظاهرون ميناء كندي لمنع سفينة اسرائيلية الرسو
1,وزير الخارجية اليمني يزور مسقط لدفع بعملية السلام
1,وفد الحوثيين مسقط يحاور مبعوثي عدة جهات دولية
1,مقال صحيفة بريطانية يذكر ان اهم اهداف الحكومة الاسرائيلية الجديدة تخلص ولاية نتنياهو
1,مقال غارديان الدعم البريطاني لـ اسرائيل يساعد بقاء الاحتلال
1,اتفاق عراقي امريكي خطة لاعادة انتشار قوات التحالف الدولي
1,واشنطن وبغداد يناقشان اليات سحب قوات التحالف الدولي العراق
1,امير قطر يبحث رئيس الوزراء الفلسطيني اعادة اعمار غزة وحماية الاقصى
1,اشتية يلتقي نظيره القطري ويبحث تعزيز التعاون المشترك
1,وصف الرئيس الروسي تهديد الولايات المتحدة بالفشل
1,بايدن يتعهد بتحديد خطوط حمراء لبوتين
1,افرجت سلطات الاحتلال الاسرائيلي مراسلة الجزيرة بالقدس
1,سلطات الاحتلال تعتقل مراسلة الجزيرة وتعتدي عليها
1,مسلحون يقتلون اكثرمن مدني بوركينافاسو
1,مقتل شرطيا الاقل بوركينافاسو
1,عشرات القتلى اشتباكات افغانستان طالبان تزامنا بدا جولة المبعوث الاميركي الخاص لافغانستان
1,خليل زاد يلتقي الزعماء الافغان لبحث عملية السلام
