Type,Removed_stopwords
0,صادرات اربد تنخفض وغرفة الصناعة تدعو لانقاذ الصناعات المتضررة
0,لاول مرة عاما تسويق منتجات غذائية غزة اسواق الضفة
0,عمان تعتزم اطلاق مبادرة لدعم وصول المنتج العماني للاسواق المحلية والعالمية
0,ماكنزي ضغوط كورونا ستواجه بنوك العالم لـ سنوات
0,زيوريخ كابيتال تطلق دبي اول بنك اسلامي رقمي العالم
0,تدهور مخيف للريال اليمني يعمق الازمة الاقتصادية والمعيشية
0,تحسن طفيف للريال اليمني طرح المبادرة السعودية
0,توقيع مذكرة تفاهم شركة العال طيران الخليج البحرينية تروج لرحلاتها الى اسرائيل
0,نتنياهو سوينا الخلاف الاردن خلال ساعات وتوصلنا لـ اتفاقات محمد بن زايد
0,فيتش تصدم الاقتصادات الكبرى وتستبعد رفع تصنيفها الائتماني
0,ستاندرد اند بورز تؤكد التصنيف الائتماني الياباني الاشارة للتعافي الاقتصادي
0,يومين المكاسب الذهب يعاود الهبوط
0,الذهب يصعد هبوط الدولار وتراجع سندات الخزانة الاميركية
0,اسعار الذهب تصعد لقمة اسبوعين بدعم امريكي الاوقية بـ
0,الذهب يهبط ذروة اسابيع
0,مهمة القرن شركات الطيران العالمية تستعد لنقل ملايين جرعات لقاح كورونا
0,لولايات المتحدة تحذر شركات الطيران التحليق الحدود الروسية – الاوكرانية
0,اكثر نصف اللبنانيين فقراء ودخل المياوم دولارات اليوم
0,خبراء معدلات الفقر العراق تجاوزت دول مجاهل افريقيا
0,وزير النفط العراقي صناعة البترول وضع حرج
0,واردات الصين النفط السعودي تزيد
0,ارتفاع بورصات الخليج الرئيسية وقطر تقود مكاسب اليوم
0,تباين اداء بورصات الخليج اولى جلسات الاسبوع
0,اول تقرير يرصد فرص الاستثمار قطر وتركيا
0,تعزيز علاقات الشراكة قطر كندا وتشجيع الاستثمار الاوراق المالية
0,اكبر ارتفاع سنوي لليوان صعد مقابل الدولار وتوقعات بمزيد
0,رجل اعمال روسي كبير يتوقع ان اليوان الرقمي ستؤثر مكانة الدولار
0,كوفيد يسرع التحول الى الطب الرقمي
0,حجمها مليار صناعة العاب الفيديو تتفوق الرياضة والافلام مجتمعة
0,اسعار النفط تقفز بنحو قرار اوبك زيادة الانتاج اعتبارا
0,رويترز نسبة التزام اوبك بخفض انتاج النفط
0,عمليات الاحتيال طريق الاستثمار الوهمي اصبحت اكثر احترافسة فعالة يشكل مخيف
0,عضو كبار العلماء بالسعودية يحرم عملة بيتكوين ويوضح سبب التحريم
0,سيلزفورس توقع اتفاقا لشراء سلاك مقابل مليار
0,شركات التكنولوجيا تستحوذ العلامات التجارية الاغلى قيمة
0,الاستثمارات العامة السعودي يخطط لجمع مليارات
0,البترول الكويتية تعتزم الحصول قرض بقيمة مليار
0,الدولار ادنى مستوياته شهرا المستثمرون يراهنون مزيد التحفيز
0,المركزي زيادة مبيعات السندات الامريكية حزم التحفيز الاقتصادي خلال الماضي
0,الدولار ادنى مستوياته شهرا المستثمرون يراهنون مزيد التحفيز
0,الاعلام العربي والعالمي يثني استعدادات قطر للمونديال
0,قطر توقع عقود شراء حافلات صديقة للبيئة بـ مليارات
0,الصين وفرنسا توقعان اتفاقيات بالمليارات
0,جهاز قطر للاستثمار يتملك اسهم بورصة اسطنبول
0,للمرة الثانية بورصة اسطنبول توقف العمل بسبب التراجع الحاد لليرة
0,محكمة دبي تدين وزيرا سعوديا بالنصب رجل اعمال فلسطيني
0,الصين تغرم علي بابا مبلغ مليار بدعوى الاحتكار
0,وزير النفط العراقي يتوقع تارجح اسعار النفط دولارا خلال عام
0,سعر البترول يتراجع بفعل توقعات بانكماش الطلب الهندي النفط
0,الجمعة السوداء تفقد بريقها والتسوق عبر الانترنت ينمو بالمئة
0,بوتين يقر بوجود صعوبات الاقتصاد الروسي جراء كورونا
0,توقيع اتفاقيات قطر وتركيا وتميم اتفقت اخي اردوغان توطيد الشراكة
0,الصين تصادق رسميا اتفاقية الشراكة الاقتصادية الاقليمية الشاملة
0,اجراءات بطيئة للغاية ايران تلجا الى اقسى حالات الاغلاق للحد كورونا
0,عقد الثورة الاقتصاد السوري القاع واقتصاد الظل يتمدد البلاد
0,الحكومة العراقية تقر مبدا الدفع المسبق لمبيعات النفط لمواجهة ازمتها المالية
0,اتحاد جدة ينهي ازمته المالية الترجي
0,تعاون مرتقب سوق ابوظبي والاوراق المالية الاسرائيلية
0,هيئة الاوراق المالية الامريكية تشعل جهة صراع جديدة ريبيل
0,بتكوين تبلغ الف لاول مرة
0,تكوين تفقد مستويات هامة وتخسر مليار
0,قطر تبدا اجراءات قانونية ضد بنك ابو ظبي الاول نزاع بشان تلاعب بالسوق
0,بنك ابوظبي الاول يباشر بنقل الاسهم لاتمام استحواذه راسمال بنك عوده مصر
0,مكاتب سياحة ستغلق مكاتبها وتسرح موظفيها
0,رم نشاط ملحوظ لحركة الزوار المخيمات السياحية قبيل رمضان
0,قادتها تعهدوا بتوزيع عادل للقاح مجموعة العشرين تدرس منح مليار جرعة ضد كورونا لتصل للفقراء
0,الصحة العالمية نهدف لتصنيع مليار جرعة لقاح كورونا بحلول نهاية
0,دبي المالي العالمي يوقع اتفاقية بنك اسرائيلي
0,اتفاقية تعاون البنك العربي وشركة الحوسبة الصحية الدولية
0,الاتحاد للطيران توسع مسار التعاون العال الاسرائيلية
0,مذكرة تفاهم مصر والاردن مجال تكنولوجيا المعلومات
0,افتتاح معبر عرعر العراق والسعودية اغلاق عاما
0,رغم كورونا زيادة حجم التبادل التجاري تركيا وتشاد
0,امريكا ترفع حظر تحليق طائرة بوينغ ماكس
0,مروحية ناسا تحقق بنجاح اول عملية طيران الغلاف الجوي للمريخ
0,ارامكو السعودية تبيع سندات بـ مليارات لتمويل توزيع سندات بـ مليلرات
0,مصر تبيع سندات دولارية بـ مليارات
0,الخطوط القطرية ضمن الشركات رفعت نيجيريا الحظر المفروض عنها
0,خسائر الطيران العالمي تصل لـ مليار لعام
0,اكد الرئيس التنفيذي لبنك قطر للتنمية ان البنك استطا المساهمة جهود الدولة للتصدي لتداعيات جائحة فيروس كورونا المستجد
0,بنك قطر الاول يتحول للربحية الربع الاول بدعم التخارجات
0,تراجع ارباح شركة ارامكو السعودية بنحو لتصل الى مليار
0,سنيورة تصادق توزيع ارباح بقيمة مليون
0,ايران احتجاجات استمرار نزف البورصة
0,الاسد يصدر مرسوما لضبط الاسعار سجن وغرامات بحق المخالفين
0,تحسن مفاجئ لليرة التركية سلسلة خسائر تجاوزت الـ بالمئة
0,لبنان تراجع سعر الدولار مقابل الليرة فى تعاملات اليوم
0,وزارة التخطيط العراقية مشروعا مهددا بالتوقف بسبب الازمة المالية
0,الجزائر تلجا الى اوروبا لتجاوز الازمة المالية‎
0,ارتفاع البطالة بالسعودية انكماش الاقتصاد بالربع بسبب كورونا
0,اكثر نصف الاردنيين يصنفون الوضع الاقتصادي سلبيا
0,اتفاق الغاز الطبيعي قطر وسنغافورة يعرض تفاصيل انبعاثات الكربون اخبار الشرق الاوسط
0,توقيع اول اتفاق تعاون بنكين اسرائيليين وثالث بحريني
0,الاسواق تضاعف مكاسبها اعلان فايزر نجاح لقاح كورونا
0,الاسهم الامريكية تهبط بسبب تضرر اسهم السفر قفزة الاصابات
0,قفزة كبيرة باسعار الوقود السودان واستياء شعبي
0,تونس ترفع اسعار الوقود لخفض العجز الموازنة العامة
0,هبوط شديد لليرة التركية قرار اردوغان اقالة محافظ البنك المركزي
0,البنك المركزي التركي يبقي الفائدة معدلها اي تغيير
0,النفط يهوي بسبب جائحة كورونا ورئاسيات امريكا
0,النفط يتعافى خسائره ويصعد الى الاعلى
0,الكاظمي يفتتح البرج الاضخم بصناعة الغاز ارطاوي بالبصرة
0,اذربيجان تخفض انتاج النفط وترفع انتاج الغاز الطبيعي الربع الاول
0,الاردن انخفاض الانفاق الحملات الانتخابية يكرس ركود الاسواق
0,توقعات فلسطينية بحل قريب لمسالة العوائد المالية اسرائيل
0,الليرة التركية تتهاوى امام الدولار
0,تركيا تحظر استخدام العملات المشفرة المدفوعات
0,ارباح مجموعة ارامكو الصافية تتراجع بنسبة المئة بسبب انخفاض اسعار النفط
0,ارباح المتحدة للتنمية تتراجع بالربع الاول
0,السعودية ارتفاع قيمة القروض الممنوحة البنوك للمؤسسات الحكومية والقطاع الخاص الى مليار بنهاية
0,توافق البنوك تاجيل اقساط قروض الافراد الشهر المقبل
0,الاقتصاد البريطاني يواجه تهديد اغلاق مدمرا خلفية كورونا
0,الاقتصاد البريطاني ينتعش رغم القيود المرتبطة بالجائحة
2,راموس يقترب الرحيل مدريد
2,مدريد مهدد بتلقى عقوبة الاتحاد الاوروبي
2,البرق يقتل بطلة الشراع اثناء تدريبها البحر
2,بطلة رياضية تطمح لخلافة ميركل
2,مورينيو تخطي استون فيلا احتجنا هزيمة فظيعة لتحقيق الفوز
2,مورينيو يبعث رسالة مصالحة الى لاعبي توتنهام الفوز استون فيلا
2,برشلونة يواصل مطاردة اتلتيكو ويكتسح سوسيداد بستة اهداف
2,برشلونة يدرس استعادة لاعبه السابق ارسنال
2,بفضل اوبلاك وسواريز اتلتيكو مدريد يهزم الافيس ويحصن صدارة الليجا
2,اتلتيكو مدريد وانتر ميلان ينسحبان السوبر ليج
2,ليستر سيتي يهزم مانشستر يونايتد بثلاثية ويتاهل لنصف نهائي كاس الاتحاد الانجليزي
2,ليستر سيتي يواجه تشيلسي نهائي كاس انجلترا
2,ميلان يفلت كمين فيورنتينا بفوز صعب ويواصل مطاردة انتر بالدوري الايطالي
2,رسميا ميلان يلحق بانتر ويتخلى المشروع الوليد
2,لاعبين واعدين انظار بلماضي كاس افريقيا
2,الترجي التونسي يفاجئ جماهيره بابرز اكتشافات الدوري الجزائري
2,بينفينتو يفسد احتفالية رونالدو ويسقط يوفنتوس الدوري الايطالي
2,يوفنتوس فرصة لاستكمال دوري السوبر الاوروبي
2,هالاند يغادر ملعب مباراة دورتموند غاضبا
2,دورتموند يحيي اماله التاهل لدوري الابطال بالفوز اونيون برلين
2,مانشستر سيتي يحتفل باكثر رقم قياسي الفوز ايفرتون
2,مانشستر سيتي يعزز صدارته للدوري الانكليزي بالفوز استون فيلا
2,سقوط طائرة مسيرة اثناء مباراة بالدوري الاسباني ملعب فريق اتلتيك بيلباو
2,بنزيما يتفوق كريستيانو رونالدو الدوري الاسباني
2,بنزيما يقود مدريد مواصلة قطار الانتصارات بفوز صعب سيلتا فيغو
2,مدريد مهدد بتلقى عقوبة الاتحاد الاوروبي
2,رسميا عدم السماح للجماهير خارج اليابان بحضور الاولمبياد
2,قرعة اولمبياد طوكيو مواجهات صعبة لممثلي الكرة العربية
2,مالك تشيلسي يدافع سياسة طرد المدربين
2,تشلسي يفوز بورتو ويضع قدما بنصف نهائي لدوري ابطال اوروبا
2,المال وحده يكفي لحسم انتقال مبابي وهالاند لريال مدريد
2,اخبار مدريد بيريز رئيسا لدوري السوبر الاوروبي وبوتشيتينو واثق بقاء مبابي
2,اسبوع حاسم لريال مدريد الدوري الاسباني والاوروبي
2,تشيفرين يلمح لمنع مدريد نصف نهائي الابطال وبيريز يرد
2,نبيل فقير يصبح حديث المتابعين حول العالم بهدف الـ مارادوني
2,الدوري الاسباني يخطط لعودة الجماهير
2,رونالدو يحصد جائزة افضل لاعب الدوري الايطالي لموسم
2,الدوري الايطالي نابولي يكتسح لاتسيو
2,اقصاء توتنهام الدوري الاوروبي امام دينامو زغرب
2,برشلونة يوقع اتفاقية الانضمام لبطولة الدوري الاوروبي الممتاز
2,نتائج قرعة ربع نهائي الدوري الاوروبي تسفر مواجهات مثيرة
2,يعلن قرعة ربع نهائي دوري ابطال افريقيا اون لاين ابريل
2,مدريد مهمة صعبة وباريس يصطدم ببايرن ميونيخ
2,بايرن ميونخ يحقق فوزا بطعم العلقم باريس سان جيرمان
2,مورينيو يهاجم لاعبي توتنهام وداع الدوري الاوروبي امام دينامو زغرب
2,سون يقود توتنهام الى اول فوز حقبة مورينيو
2,دينامو زغرب يقصي توتنهام بثلاثية اورسيتش ويبلغ دور الثمانية بالدوري الاوروبي
2,توتنهام يتواصل خليفة مورينيو
2,ظاهرة مالوفة هالك البرازيلي يفقد كيلو عقب مباراة
2,المانيا امام فرصة اوليمبية للثار البرازيل
2,اختار عدد المشجعين توجيه اللوم الى لاعب المنتخب البلجيكي الاصابة الجديدة لهازارد
2,هازارد جاهز للمشاركة مدريد امام بيتيس
2,الشاب انريكي ريكيلمي مليونير وسيم ينافس بيريز رئاسة مدريد
2,مدريد مهدد بالخروج ابطال الاوروبا
2,اصل المدربون الالمان يغزون ربع نهائي دوري الابطال
2,نيمار افضل لاعب مباريات اياب ربع نهائي دوري ابطال اوروبا
2,توخيل مدرب تشيلسي يصنع تاريخ النادي باطول بداية بدون هزيمة
2,تفوق ايراني ونتائج كارثية للاندية العراقية دوري الابطال
2,تاهل تاريخي لبايرن ميونيخ وتشيلسي ينهي عقدة ربع نهائي ابطال اوروبا
2,موعد ونظام قرعة ربع نهائي دوري ابطال افريقيا
2,حيرة مدريد ومنتخب بلجيكا حول اصابة هازارد
2,تصريحات مثيرة بيريز ايقاف مشروع السوبر ليج
2,جماهير الزمالك تهاجم وزير الرياضة المصري وتطلب اقالته
2,الاهلى يطلب اتحاد الكرة تاجيل مباراة القمة امام الزمالك
2,مدريد يضرب اتالانتا بثلاثية ويتاهل الى ربع النهائي
2,بيريز يحسم مستقبل زيدان وفينيسيوس مدريد ويشكر مورينيو
2,مانشستر سيتي يكرر فوزه جلادباخ بهدفين ويتاهل لربع نهائي دوري الابطال
2,اربعة اندية تنضم الى مانشستر سيتي الانسحاب بطولة سوبر ليغ
2,دوري ابطال افريقيا مولودية الجزائر يهزم تونجيث بهدف ويقترب التاهل لربع نهائي البطولة
2,الخروج الحزين الزمالك يودع ابطال افريقيا
2,الوداد يتاهل رسميا الى ربع نهائى دورى ابطال افريقيا التعادل حوريا
2,مدربان تونسيان راس قطبي الكرة المغربية الرجاء والوداد
2,الاهلي يقسو فيتا كلوب بثلاثية نظيفة دوري ابطال افريقيا
2,الاهلي المصري يفقد النقاط الثمينة بتعثره امام سموحة الوقت القاتل
2,بسبب كثرة اصاباته جماهير مدريد تطالب برحيل هازارد وعودة رونالدو
2,زيدان يصدم جماهير مدريد بهوية الغائبين مباراة قادش
2,الاتحاد السعودي يغلق قضايا المعلقة
2,الاتحاد السعودي يحدد عدد اللاعبين الاجانب بالموسم المقبل
2,حارس ولفرهامبتون يتعرض لاصابة خطيرة خلال محاولته ايقاف صلاح
2,هنري مالك ليفربول يتقدم بالاعتذار ازمة دوري السوبر الاوروبي لكرة القدم
2,برشلونة يلاحق اتلتيكو مدريد برباعية هويسكا بالدورى الاسبانى
2,برشلونة يخطط للتعاقد مهاجم سوسيداد الشاب
2,اصابة جديدة لهازارد عضلات الساق اليسرى
2,قيمة هازارد السوقية تواصل تراجعها القياسي
2,اكثر الف اختطاف وسطو مسلح منزلي نجمي باريس جيرمان
2,الدوري الفرنسي هدف قاتل لايكاردي يضع سان جيرمان نقطة ليل
2,رونالدو يهزم كالياري ويقود يوفنتوس الى وصافة الدوري الايطالي
2,نابولي يكتسح لاتسيو بخماسية الدوري الايطالي
2,ترتيب ارسنال الدوري الانجليزي الفوز توتنهام فى ديربي لندن
2,عاصفة السوبر الاوروبي تدفع ملاك ارسنال لبيعه
2,لاميلا يخطف الانظار بهدف عالمي ديربي توتنهام وارسنال
2,جاريث بيل ينتقد طريقة لعب مورينيو اقالته تدريب توتنهام
2,الدوري الايطالي الانتر يحلق وميلان يسقط ويوفنتوس يطارد الوصافة
2,اتليتكو وانتر يلحقان بالاندية المنسحبة مشروع سوبر ليج
2,زيدان يوضح سبب تغيير طريقة لعب مدريد امام التشي
2,زيدان حدث امر سخيف وهذا النادي احمله قلبي
2,فترة طويلة بدا ان ليفاندوفسكي طريقه لتجاوز رقم المستحيل الدوري الالماني
2,اهداف الثلاثاء بايرن ميونخ يفوز ليفركوزن الدوري الالماني
2,مانشستر سيتي يواصل سلسلة انتصاراته ويعزز صدارته للبريميرليغ
2,التايمز مبعوث جونسون حذر الامارات بتاثر العلاقات شارك مانشستر سيتي دوري السوبر الاوروبي
2,شائعات متوقعة ومنتظرة بيرلو يرد انباء رحيل رونالدو يوفنتوس
2,مصادرنا تؤكد استقالة انييلي رئيس يوفنتوس منصبه
2,بهدفين بنزيما يقود الريال لفوز صعب الليغا
2,اتلتيكو مدريد ينفرد بصدارة الليغا
2,بايرن ميونيخ يعزز صدارته برقم تهديفي جديد لليفاندوفسكي
2,الدوري الالماني هدايا لايبزيج تضع بايرن ميونخ حافة اللقب
2,ليدز يفرض التعادل السلبي تشيلسي
2,عضو تنفيذية يويفا تستبعد اندية تشيلسي وسيتي وريال مدريد الموسم الحالي للابطال
2,الاولمبية الدولية توافق مجموعة اصلاحات لجعل الالعاب اكثر جاذبية
2,الاولمبية الدولية تمنع الحركات الاحتجاجية للرياضيين المنصات طوكيو وبكين
2,زيدان يثير الجدل بتصريحات عودة رونالدو لريال مدريد
2,ديبالا دخلت تحد رونالدو وقدوم ميسي ليوفنتوس صعب
2,وعد ناد روسي جمهورة بالحصول لقاح كورونا الروسي سبوتنيك ملعبه خلال الموسم
2,زفان يبلغ نصف نهائي كاس روسيا
2,الفرنسي كارتيرون يعود لتدريب الزمالك اشهر السعودية
2,الزمالك يهزم هليوبوليس ويتاهل لمواجهة الاهلي نهائي كاس مصر لكرة اليد
2,الخليفي نيمار ومبابي لديهما اعذار للرحيل باريس سان جيرمان
2,مدرب البرازيل يامل تحرير نيمار للمشاركة المنتخب الاولمبي
2,راموس قائد مدريد يدافع الحكام وتقنية الفيديو
2,رغم فوز فريقه راموس غاضب مباراة مدريد وليفربول
2,نافاس ينقذ باريس سان جيرمان امام برشلونة
2,نافاس نجم الشهر الدوري الفرنسي
2,مانشستر سيتي يكتسح ساوثهامبتون ويبتعد الصدارة
2,الدوري الانجليزي يصدر بيانا للرد اقامة دوري السوبر الاوروبي
2,العدالة لدييغو مسيرة ارجنتينية للتحقيق وفاة مارادونا
2,ميسي يكرر فعله مارادونا ويسجل الافضل تاريخ برشلونة
2,انساكم المغربي بلهندة يودع غلطة سراي ايام فسخ تعاقده
2,اصابة نجم غلطة سراي المصري بفيروس كورونا
2,لاعب برازيلي شهير يعاقب بالسجن سنوات بتهمة االاتهام بالاعتداء الجنسي
2,مدرب البرازيل يريد نيمار المنتخب اولمبياد طوكيو
2,البرازيل تصوت وضع اسم بيليه استاد ماراكانا الشهير
2,سلطات ريو تتراجع طلب اطلاق اسم بيليه ملعب ماراكانا
2,هالاند وكسر الارقام القياسية قصة عشق تنتهي
2,دورتموند يحدد المصير النهائي لـ هالاند
2,بورتو يحقق مفاجاة مدوية ويقصي يوفنتوس دوري الابطال
2,اليويفا يقرر مصير مدريد بدوري ابطال اوروبا
2,فيدرر يتطلع للمشاركة الاولمبياد اذا كانت ركبته بحالة جيدة
2,اولمبياد طوكيو القرعة تقسو مصر والسعودية
2,هالاند يقود بوروسيا دورتموند لربع نهائي دوري الابطال حساب اشبيلية
2,دورتموند يحبط احلام برشلونة وريال مدريد التعاقد هالاند
2,اليابان تقرر اقامة اولمبياد طوكيو بدون جماهير اجنبية خوفا انتشار فيروس كورونا
2,منع الرياضيين الركوع اولمبياد طوكيو
2,كرة القدم يواكيم لوف يؤكد انه سيتخلى تدريب منتخب المانيا كاس الامم الاوروبية
